{"$schema":"https://json-schema.org/draft/2020-12/schema","additionalProperties":false,"properties":{"authorization":{"const":"not_established"},"child_acceptance":{"const":"not_established"},"child_id":{"pattern":"^S[1-9][0-9]{0,5}$","type":"string"},"consumer_execution":{"const":"not_observed"},"files":{"additionalProperties":{"pattern":"^[0-9a-f]{64}$","type":"string"},"maxProperties":1100,"minProperties":6,"propertyNames":{"pattern":"^[a-zA-Z0-9][a-zA-Z0-9._-]{0,119}$"},"type":"object"},"parent":{"additionalProperties":false,"properties":{"continuity_sha256":{"anyOf":[{"pattern":"^[0-9a-f]{64}$","type":"string"},{"type":"null"}]},"contract_id":{"pattern":"^[a-z0-9][a-z0-9-]{0,79}$","type":"string"},"contract_sha256":{"pattern":"^[0-9a-f]{64}$","type":"string"},"revision":{"maximum":999999,"minimum":1,"type":"integer"},"source_bundle_sha256":{"pattern":"^[0-9a-f]{64}$","type":"string"},"source_chain_sha256":{"pattern":"^[0-9a-f]{64}$","type":"string"}},"required":["contract_id","revision","contract_sha256","source_bundle_sha256","source_chain_sha256","continuity_sha256"],"type":"object"},"plan_sha256":{"pattern":"^[0-9a-f]{64}$","type":"string"},"record":{"const":"intentline.slice-handoff"},"schema_version":{"const":1},"semantics":{"const":"unverified"},"validation":{"const":"structurally_validated"}},"required":["record","schema_version","parent","plan_sha256","child_id","authorization","consumer_execution","child_acceptance","validation","semantics","files"],"type":"object"}
