{"authorization":"not_established","child_acceptance":"not_established","child_id":"S1","consumer_execution":"not_observed","files":{"child.json":"8d30b2abf8785e46d58c68538a722d7ee12dddc571997765693fda160e23f4bd","contract.json":"983effa47fd79dbefd9e26814af7affc661caaa1d0c1dd2bbe3e4f30c255861b","history.json":"9b45a0b7f9b1911489cbd98ac05376d863e3af61e139ceb21cddf4215a79e6f4","inspect_child.py":"8fad8c5692665b1dd5bb0095001a608e81732e1e1b5a7eef47f420b093682d48","plan.json":"3bc8ee7e3622b57e3ffe0b0fef16ee8817483849b835fb766e55b553557dedee","source-S1.txt":"54962ec5ec269555068401d68869d652bbb6545333250593b07424bc6ba6241d","source-manifest.json":"15df00ccc974cf497ccf4ca74c4166972c39d45033be089387fecc6f0a262c9a"},"parent":{"continuity_sha256":null,"contract_id":"username-validation","contract_sha256":"983effa47fd79dbefd9e26814af7affc661caaa1d0c1dd2bbe3e4f30c255861b","revision":1,"source_bundle_sha256":"15df00ccc974cf497ccf4ca74c4166972c39d45033be089387fecc6f0a262c9a","source_chain_sha256":"5937cd28651bd76ba49dd1fe0081fbf640e412c3ae2dca53d18f6e4f6cd86f07"},"plan_sha256":"3bc8ee7e3622b57e3ffe0b0fef16ee8817483849b835fb766e55b553557dedee","record":"intentline.slice-handoff","schema_version":1,"semantics":"unverified","validation":"structurally_validated"}
